{
  "slug": "quantum-histamine-neurotransmitter",
  "path": "articles/05-systems/tansmitters/NT-HISTAMINE.md",
  "title": "**Quantum Histamine Neurotransmitter**",
  "status": "draft",
  "version": "0.1.0",
  "tags": [
    "multiplicity"
  ],
  "created": "2026-03-20",
  "updated": "2026-03-20",
  "stratum": "",
  "operator_class": "",
  "xi_domain": "",
  "csl_role": ""
}
