{"slug":"8-one-loop-health-education","path":"articles/04-domains/education/8. One-loop Health–education.md","title":"8. One-loop Health–education","status":"draft","version":"0.1.0","tags":["multiplicity"],"created":"2026-03-20","updated":"2026-03-20","stratum":"","operator_class":"","xi_domain":"","csl_role":""}
