{
  "slug": "executive-summary-prime-encoded-quantum-van-der-waals-algorithms",
  "path": "articles/05-systems/algorithms/P-VANDERWAALS.md",
  "title": "**Executive Summary: Prime-Encoded Quantum Van der Waals Algorithms**",
  "status": "draft",
  "version": "0.1.0",
  "tags": [
    "multiplicity"
  ],
  "created": "2026-03-20",
  "updated": "2026-03-20",
  "stratum": "",
  "operator_class": "",
  "xi_domain": "",
  "csl_role": ""
}
