{
  "slug": "the-matrix-prime-compute-engine-mpce-a-technical-monograph-on-its-mathematical-foundations-and-archi",
  "path": "articles/02-implementations/matrix/The Matrix Prime Compute Engine (MPCE)_ A Technical Monograph on its Mathematical Foundations and Architecture.md",
  "title": "The Matrix Prime Compute Engine (MPCE)_ A Technical Monograph on its Mathematical Foundations and Architecture",
  "status": "draft",
  "version": "0.1.0",
  "tags": [
    "multiplicity"
  ],
  "created": "2026-03-20",
  "updated": "2026-03-20",
  "stratum": "",
  "operator_class": "",
  "xi_domain": "",
  "csl_role": ""
}
