{"slug":"ceqg-rg-langevin-blueprint","path":"articles/04-domains/meta-relativity/CEQG-RG-Langevin Blueprint.md","title":"CEQG-RG-Langevin Blueprint","status":"draft","version":"0.1.0","tags":["multiplicity"],"created":"2026-03-20","updated":"2026-03-20","stratum":"","operator_class":"","xi_domain":"","csl_role":""}
