{
  "slug": "geoffrey-ingram-taylor",
  "path": "articles/06-people/Geoffrey Ingram Taylor.md",
  "title": "Geoffrey Ingram Taylor",
  "status": "draft",
  "version": "0.1.0",
  "tags": [
    "multiplicity"
  ],
  "created": "2026-03-20",
  "updated": "2026-03-20",
  "stratum": "",
  "operator_class": "",
  "xi_domain": "",
  "csl_role": ""
}
