{"slug":"al-gft-thematic-analysis-the-evolution-of-gravity-into-a-complex-open-system","path":"articles/04-domains/meta-relativity/AL-GFT - Thematic Analysis_ The Evolution of Gravity into a Complex Open System.md","title":"AL-GFT - Thematic Analysis_ The Evolution of Gravity into a Complex Open System","status":"draft","version":"0.1.0","tags":["multiplicity"],"created":"2026-03-20","updated":"2026-03-20","stratum":"","operator_class":"","xi_domain":"","csl_role":""}
