{
  "slug": "project-proposal-integration-of-the-elastic-tether-protocol",
  "path": "articles/05-systems/elastic-tether/Project Proposal_ Integration of the Elastic Tether Protocol.md",
  "title": "Project Proposal_ Integration of the Elastic Tether Protocol",
  "status": "draft",
  "version": "0.1.0",
  "tags": [
    "multiplicity"
  ],
  "created": "2026-03-20",
  "updated": "2026-03-20",
  "stratum": "",
  "operator_class": "",
  "xi_domain": "",
  "csl_role": ""
}
