{
  "slug": "the-mathematics-of-multiplicity",
  "path": "articles/03-case-studies/The Mathematics of Multiplicity.md",
  "title": "The Mathematics of Multiplicity",
  "status": "draft",
  "version": "0.1.0",
  "tags": [
    "multiplicity"
  ],
  "created": "2026-03-20",
  "updated": "2026-03-20",
  "stratum": "",
  "operator_class": "",
  "xi_domain": "",
  "csl_role": ""
}
