{
  "slug": "executive-summary-james-webb-s-contributions-and-integration-within-the-matrix-compute-paradigm-mcp",
  "path": "articles/06-people/James Webb.md",
  "title": "**Executive Summary: James Webb's Contributions and Integration within the Matrix Compute Paradigm (MCP)**",
  "status": "draft",
  "version": "0.1.0",
  "tags": [
    "multiplicity"
  ],
  "created": "2026-03-20",
  "updated": "2026-03-20",
  "stratum": "",
  "operator_class": "",
  "xi_domain": "",
  "csl_role": ""
}
