{
  "slug": "jordanus-de-nemore",
  "path": "articles/06-people/Jordanus de Nemore.md",
  "title": "Jordanus de Nemore",
  "status": "draft",
  "version": "0.1.0",
  "tags": [
    "multiplicity"
  ],
  "created": "2026-03-20",
  "updated": "2026-03-20",
  "stratum": "",
  "operator_class": "",
  "xi_domain": "",
  "csl_role": ""
}
