{"slug":"prime-encoded-quantum-combinatoric-pingala-algorithm","path":"articles/05-systems/algorithms/P-COMPINGALA.md","title":"**Prime Encoded Quantum Combinatoric Pingala Algorithm**","status":"draft","version":"0.1.0","tags":["multiplicity"],"created":"2026-03-20","updated":"2026-03-20","stratum":"","operator_class":"","xi_domain":"","csl_role":""}
