{
  "slug": "plato-s-cave-simulator-hierarchical-trust-oracle-invariance-and-meta-reforms-formalization-final-cod",
  "path": "articles/02-implementations/platos-cave/Plato_s Cave Simulator_ Hierarchical Trust, Oracle Invariance, And Meta-reforms (formalization + Final Code).md",
  "title": "Plato_s Cave Simulator_ Hierarchical Trust, Oracle Invariance, And Meta-reforms (formalization + Final Code)",
  "status": "draft",
  "version": "0.1.0",
  "tags": [
    "multiplicity"
  ],
  "created": "2026-03-20",
  "updated": "2026-03-20",
  "stratum": "",
  "operator_class": "",
  "xi_domain": "",
  "csl_role": ""
}
