{
  "slug": "amalie-emmy-noether",
  "path": "articles/06-people/Amalie Emmy Noether.md",
  "title": "Amalie Emmy Noether",
  "status": "draft",
  "version": "0.1.0",
  "tags": [
    "multiplicity"
  ],
  "created": "2026-03-20",
  "updated": "2026-03-20",
  "stratum": "",
  "operator_class": "",
  "xi_domain": "",
  "csl_role": ""
}
