{"slug":"dual-representation-principle","path":"articles/00-foundations/phase-mirror/Dual-Representation Principle.md","title":"Dual-Representation Principle","status":"draft","version":"0.1.0","tags":["multiplicity"],"created":"2026-03-20","updated":"2026-03-20","stratum":"","operator_class":"","xi_domain":"","csl_role":""}
