{
  "slug": "categorical-extension-kernel-as-runtime-endofunctor-with-multiplicity-conservation",
  "path": "articles/05-systems/Π‑kernel/Categorical Extension — Π‑kernel As Runtime Endofunctor With Multiplicity Conservation.md",
  "title": "Categorical Extension — Π‑kernel As Runtime Endofunctor With Multiplicity Conservation",
  "status": "draft",
  "version": "0.1.0",
  "tags": [
    "multiplicity"
  ],
  "created": "2026-03-20",
  "updated": "2026-03-20",
  "stratum": "",
  "operator_class": "",
  "xi_domain": "",
  "csl_role": ""
}
