{"slug":"executive-summary-zeta-based-quantum-algorithms","path":"articles/05-systems/zeta/Z-CHAOS.md","title":"**Executive Summary: Zeta-Based Quantum Algorithms**","status":"draft","version":"0.1.0","tags":["multiplicity"],"created":"2026-03-20","updated":"2026-03-20","stratum":"","operator_class":"","xi_domain":"","csl_role":""}
