{
  "slug": "coding-programming",
  "path": "articles/03-case-studies/Coding Programming.md",
  "title": "Coding Programming",
  "status": "draft",
  "version": "0.1.0",
  "tags": [
    "multiplicity"
  ],
  "created": "2026-03-20",
  "updated": "2026-03-20",
  "stratum": "",
  "operator_class": "",
  "xi_domain": "",
  "csl_role": ""
}
